{
  "schemaVersion": "1.0.0",
  "profileId": "profile-scoring-fixture",
  "roles": [
    {
      "id": "role-1",
      "title": "Senior Backend Engineer",
      "organization": "Acme Corp",
      "startDate": "2021-03",
      "endDate": null,
      "achievements": [
        {
          "id": "ach-1",
          "bulletPoint": "Led migration of the billing service to a new PostgreSQL datastore, cutting downtime by 40%.",
          "metrics": [
            { "id": "met-1", "label": "downtime reduction", "value": "40%" }
          ]
        },
        {
          "id": "ach-2",
          "bulletPoint": "Containerized core services with Docker to standardize local and CI environments.",
          "metrics": []
        }
      ]
    }
  ],
  "skills": [
    { "id": "skill-1", "name": "TypeScript", "category": "Languages" },
    { "id": "skill-2", "name": "Node.js", "category": "Frameworks" },
    { "id": "skill-3", "name": "PostgreSQL", "category": "Databases" },
    { "id": "skill-4", "name": "Docker", "category": "Tools" }
  ]
}
